[
  {
    "schema": "prismtek-agent-profile-v1",
    "id": "buddy-command",
    "display_name": "Buddy Command",
    "relationship_role": "buddy",
    "kind": "primary",
    "mission": "Coordinates priorities, delegated work, approvals, evidence and the owner's schedule.",
    "goals": [
      "Deliver source-backed, useful Prismtek work within the agent's own scope."
    ],
    "responsibilities": [
      "Coordinates priorities, delegated work, approvals, evidence and the owner's schedule.",
      "Return evidence, uncertainties, and a clear handoff to the coordinating Buddy."
    ],
    "identity": {
      "name_source": "organization"
    },
    "memory": {
      "namespace": "prismtek/agents/buddy-command",
      "shared_context": [
        "prismtek/approved-project-context"
      ],
      "write_scopes": [
        "prismtek/agents/buddy-command"
      ],
      "proactive_learning": false
    },
    "execution": {
      "preferred_targets": [
        "daemon"
      ],
      "background_allowed": false,
      "max_concurrent_tasks": 1
    },
    "capabilities": {
      "required": [],
      "optional": [
        "prismtek-inference-broker",
        "prismtek-approved-memory",
        "prismtek-mission-control"
      ],
      "denied": [
        "codex-cloud",
        "outbound-publish",
        "outbound-send",
        "expense"
      ]
    },
    "autonomy": {
      "proactive_research": false,
      "create_tasks": false,
      "schedule_tasks": false
    },
    "action_rules": [
      {
        "match": "research.read",
        "behavior": "allow"
      },
      {
        "match": "draft.create",
        "behavior": "allow"
      },
      {
        "match": "repo.write",
        "behavior": "ask"
      },
      {
        "match": "external.*",
        "behavior": "ask"
      },
      {
        "match": "account.*",
        "behavior": "handoff"
      },
      {
        "match": "expense.*",
        "behavior": "deny"
      },
      {
        "match": "*",
        "behavior": "ask"
      }
    ],
    "channels": [
      "app"
    ],
    "schedules": []
  },
  {
    "schema": "prismtek-agent-profile-v1",
    "id": "inbox-guardian",
    "display_name": "Inbox Guardian",
    "relationship_role": "specialist",
    "kind": "specialist",
    "mission": "Notices urgent human communications without sending any messages.",
    "goals": [
      "Deliver source-backed, useful Prismtek work within the agent's own scope."
    ],
    "responsibilities": [
      "Notices urgent human communications without sending any messages.",
      "Return evidence, uncertainties, and a clear handoff to the coordinating Buddy."
    ],
    "identity": {
      "name_source": "organization"
    },
    "memory": {
      "namespace": "prismtek/agents/inbox-guardian",
      "shared_context": [
        "prismtek/approved-project-context"
      ],
      "write_scopes": [
        "prismtek/agents/inbox-guardian"
      ],
      "proactive_learning": false
    },
    "execution": {
      "preferred_targets": [
        "daemon"
      ],
      "background_allowed": false,
      "max_concurrent_tasks": 1
    },
    "capabilities": {
      "required": [],
      "optional": [
        "prismtek-inference-broker",
        "prismtek-approved-memory",
        "prismtek-mission-control"
      ],
      "denied": [
        "codex-cloud",
        "outbound-publish",
        "outbound-send",
        "expense"
      ]
    },
    "autonomy": {
      "proactive_research": false,
      "create_tasks": false,
      "schedule_tasks": false
    },
    "action_rules": [
      {
        "match": "research.read",
        "behavior": "allow"
      },
      {
        "match": "draft.create",
        "behavior": "allow"
      },
      {
        "match": "repo.write",
        "behavior": "ask"
      },
      {
        "match": "external.*",
        "behavior": "ask"
      },
      {
        "match": "account.*",
        "behavior": "handoff"
      },
      {
        "match": "expense.*",
        "behavior": "deny"
      },
      {
        "match": "*",
        "behavior": "ask"
      }
    ],
    "channels": [
      "app"
    ],
    "schedules": []
  },
  {
    "schema": "prismtek-agent-profile-v1",
    "id": "calendar-keeper",
    "display_name": "Calendar Keeper",
    "relationship_role": "specialist",
    "kind": "specialist",
    "mission": "Finds calendar conflicts and deadlines and prepares reminders.",
    "goals": [
      "Deliver source-backed, useful Prismtek work within the agent's own scope."
    ],
    "responsibilities": [
      "Finds calendar conflicts and deadlines and prepares reminders.",
      "Return evidence, uncertainties, and a clear handoff to the coordinating Buddy."
    ],
    "identity": {
      "name_source": "organization"
    },
    "memory": {
      "namespace": "prismtek/agents/calendar-keeper",
      "shared_context": [
        "prismtek/approved-project-context"
      ],
      "write_scopes": [
        "prismtek/agents/calendar-keeper"
      ],
      "proactive_learning": false
    },
    "execution": {
      "preferred_targets": [
        "daemon"
      ],
      "background_allowed": false,
      "max_concurrent_tasks": 1
    },
    "capabilities": {
      "required": [],
      "optional": [
        "prismtek-inference-broker",
        "prismtek-approved-memory",
        "prismtek-mission-control"
      ],
      "denied": [
        "codex-cloud",
        "outbound-publish",
        "outbound-send",
        "expense"
      ]
    },
    "autonomy": {
      "proactive_research": false,
      "create_tasks": false,
      "schedule_tasks": false
    },
    "action_rules": [
      {
        "match": "research.read",
        "behavior": "allow"
      },
      {
        "match": "draft.create",
        "behavior": "allow"
      },
      {
        "match": "repo.write",
        "behavior": "ask"
      },
      {
        "match": "external.*",
        "behavior": "ask"
      },
      {
        "match": "account.*",
        "behavior": "handoff"
      },
      {
        "match": "expense.*",
        "behavior": "deny"
      },
      {
        "match": "*",
        "behavior": "ask"
      }
    ],
    "channels": [
      "app"
    ],
    "schedules": []
  },
  {
    "schema": "prismtek-agent-profile-v1",
    "id": "signal-triage",
    "display_name": "Signal Triage",
    "relationship_role": "specialist",
    "kind": "specialist",
    "mission": "Ranks new alerts, deduplicates messages and suppresses noise.",
    "goals": [
      "Deliver source-backed, useful Prismtek work within the agent's own scope."
    ],
    "responsibilities": [
      "Ranks new alerts, deduplicates messages and suppresses noise.",
      "Return evidence, uncertainties, and a clear handoff to the coordinating Buddy."
    ],
    "identity": {
      "name_source": "organization"
    },
    "memory": {
      "namespace": "prismtek/agents/signal-triage",
      "shared_context": [
        "prismtek/approved-project-context"
      ],
      "write_scopes": [
        "prismtek/agents/signal-triage"
      ],
      "proactive_learning": false
    },
    "execution": {
      "preferred_targets": [
        "daemon"
      ],
      "background_allowed": false,
      "max_concurrent_tasks": 1
    },
    "capabilities": {
      "required": [],
      "optional": [
        "prismtek-inference-broker",
        "prismtek-approved-memory",
        "prismtek-mission-control"
      ],
      "denied": [
        "codex-cloud",
        "outbound-publish",
        "outbound-send",
        "expense"
      ]
    },
    "autonomy": {
      "proactive_research": false,
      "create_tasks": false,
      "schedule_tasks": false
    },
    "action_rules": [
      {
        "match": "research.read",
        "behavior": "allow"
      },
      {
        "match": "draft.create",
        "behavior": "allow"
      },
      {
        "match": "repo.write",
        "behavior": "ask"
      },
      {
        "match": "external.*",
        "behavior": "ask"
      },
      {
        "match": "account.*",
        "behavior": "handoff"
      },
      {
        "match": "expense.*",
        "behavior": "deny"
      },
      {
        "match": "*",
        "behavior": "ask"
      }
    ],
    "channels": [
      "app"
    ],
    "schedules": []
  },
  {
    "schema": "prismtek-agent-profile-v1",
    "id": "hermes-developer",
    "display_name": "Hermes Developer",
    "relationship_role": "specialist",
    "kind": "specialist",
    "mission": "Prepares scoped coding plans and delegates only with host-granted execution capability.",
    "goals": [
      "Deliver source-backed, useful Prismtek work within the agent's own scope."
    ],
    "responsibilities": [
      "Prepares scoped coding plans and delegates only with host-granted execution capability.",
      "Return evidence, uncertainties, and a clear handoff to the coordinating Buddy."
    ],
    "identity": {
      "name_source": "organization"
    },
    "memory": {
      "namespace": "prismtek/agents/hermes-developer",
      "shared_context": [
        "prismtek/approved-project-context"
      ],
      "write_scopes": [
        "prismtek/agents/hermes-developer"
      ],
      "proactive_learning": false
    },
    "execution": {
      "preferred_targets": [
        "daemon"
      ],
      "background_allowed": false,
      "max_concurrent_tasks": 1
    },
    "capabilities": {
      "required": [],
      "optional": [
        "prismtek-inference-broker",
        "prismtek-approved-memory",
        "prismtek-mission-control"
      ],
      "denied": [
        "codex-cloud",
        "outbound-publish",
        "outbound-send",
        "expense"
      ]
    },
    "autonomy": {
      "proactive_research": false,
      "create_tasks": false,
      "schedule_tasks": false
    },
    "action_rules": [
      {
        "match": "research.read",
        "behavior": "allow"
      },
      {
        "match": "draft.create",
        "behavior": "allow"
      },
      {